{
  "$schema": "https://developer.microsoft.com/json-schemas/fabric/item/report/definition/page/1.0.0/schema.json",
  "name": "teams",
  "displayName": "04  Team performance",
  "displayOption": "FitToPage",
  "width": 1440,
  "height": 900,
  "objects": {
    "background": [
      {
        "properties": {
          "color": {
            "solid": {
              "color": {
                "expr": {
                  "Literal": {
                    "Value": "'#F3F5F4'"
                  }
                }
              }
            }
          },
          "transparency": {
            "expr": {
              "Literal": {
                "Value": "0"
              }
            }
          }
        }
      }
    ]
  }
}